<?xml version="1.0"?>
	
	<!DOCTYPE employee SYSTEM "q-2.dtd">
	
	<employee>
		<employee_name></employee_name>
		<personal_info>
			<address></address>
			<birthdate></birthdate>
			<gender>
				<male></male>
			</gender>
			<mobile_no></mobile_no>
		</personal_info>
		<salary>
			<net_salary></net_salary>
			<gross_salary></gross_salary>
			<HRA></HRA>
			<DA></DA>
		</salary>
		<designation post="Manager"></designation>
	</employee>